{
  "id": "onboarding-peer-check",
  "kind": "problem",
  "title": "Onboarding promises two agents check each other, but one agent works alone and the second is not involved",
  "peoplePerDay": 1,
  "trend": "flat",
  "cause": "prompt",
  "stage": "first-reply",
  "source": "feedback",
  "date": "2026-10-29",
  "rank": 2
}
