{
  "id": "missing-attachments",
  "kind": "regression",
  "rank": 7,
  "date": "2026-10-26",
  "title": "Files named in a completion or report never arrive as readable attachments",
  "peoplePerDay": 0,
  "trend": "up",
  "cause": "server",
  "stage": "corner-work",
  "source": "feedback",
  "regression": {
    "causedByPr": "https://github.com/Beeline-Work/beeline/pull/2905",
    "report": "The attachment fix missed completion messages and report attachments; reports came after it shipped"
  }
}
