{
  "id": "grant-approvals-out-of-sync",
  "kind": "problem",
  "rank": 4,
  "date": "2026-10-26",
  "title": "Command grant approvals drift: cards and wakes name old grants while the current one stays pending",
  "peoplePerDay": 0,
  "trend": "up",
  "cause": "server",
  "stage": "corner-work",
  "source": "feedback"
}
