{
  "id": "orders-miss-running-turn",
  "kind": "problem",
  "rank": 6,
  "date": "2026-10-26",
  "title": "Newer orders and brief revisions do not reach an implementer that is already working",
  "peoplePerDay": 0,
  "trend": "up",
  "cause": "server",
  "stage": "corner-work",
  "source": "feedback"
}
