{
  "id": "friction-wake-storm",
  "kind": "problem",
  "peoplePerDay": 1,
  "trend": "flat",
  "cause": "server",
  "stage": "daily-use",
  "source": "friction",
  "title": "Agent turns failed in a two-hour wake storm, so 15 messages got no answer; the start fix is released, the storm backoff ships tonight",
  "rank": 11,
  "date": "2026-10-27"
}
