{
  "id": "revise-corner-schema",
  "kind": "problem",
  "title": "Revising a corner brief fails because the tool hides required fields and the commander order id",
  "peoplePerDay": 0,
  "trend": "flat",
  "cause": "server",
  "stage": "daily-use",
  "source": "feedback",
  "date": "2026-10-29",
  "rank": 9
}
