{
  "id": "shared-browser-android-input",
  "kind": "problem",
  "title": "On Android, typing in the shared browser does not reach the page, and the activity log credits the owner wrongly",
  "peoplePerDay": 0,
  "trend": "up",
  "cause": "client",
  "stage": "connect-service",
  "source": "feedback",
  "date": "2026-10-29",
  "rank": 7
}
