{
  "id": "revise-corner-approval-citations",
  "kind": "problem",
  "rank": 10,
  "date": "2026-10-25",
  "title": "Brief revisions refuse agent-commander orders and parent-Room approvals as approval",
  "peoplePerDay": 0,
  "trend": "up",
  "cause": "server",
  "stage": "corner-work",
  "source": "feedback"
}
