{
  "id": "idle-corner-alert-loop",
  "kind": "regression",
  "title": "The idle-corner alert fires on corners that are waiting for a reviewer or checks",
  "peoplePerDay": 0,
  "trend": "flat",
  "cause": "server",
  "stage": "daily-use",
  "source": "feedback",
  "regression": {
    "causedByPr": "https://github.com/Beeline-Work/beeline/pull/3000",
    "report": "Alerts kept firing during pending checks; a further fix shipped today and needs a day to confirm"
  },
  "date": "2026-10-29",
  "rank": 4
}
